id,created_at,text
947824196909961216,2018-01-01 13:37:52,"Will be leaving Florida for Washington (D.C.) today at 4:00 P.M. Much work to be done, but it will be a great New Year!"
947810806430826496,2018-01-01 12:44:40,Iran is failing at every level despite the terrible deal made with them by the Obama Administration. The great Iran… https://t.co/DaPjy8hPH5
947802588174577664,2018-01-01 12:12:00,"The United States has foolishly given Pakistan more than 33 billion dollars in aid over the last 15 years, and they… https://t.co/TuiaWGtnbR"
947614110082043904,2017-12-31 23:43:04,"HAPPY NEW YEAR! We are MAKING AMERICA GREAT AGAIN, and much faster than anyone thought possible!"
947592785519173637,2017-12-31 22:18:20,"As our Country rapidly grows stronger and smarter, I want to wish all of my friends, supporters, enemies, haters, a… https://t.co/irAgm3wwEU"
947588263103139841,2017-12-31 22:00:21,"Iran, the Number One State of Sponsored Terror with numerous violations of Human Rights occurring on an hourly basi… https://t.co/EHq72J2QaP"
947544600918372353,2017-12-31 19:06:52,"What a year it’s been, and we're just getting started. Together, we are MAKING AMERICA GREAT AGAIN! Happy New Year!! https://t.co/qsMNyN1UJG"
947536951464333318,2017-12-31 18:36:28,"My deepest condolences to the victims of the terrible shooting in Douglas County @DCSheriff, and their families. We… https://t.co/nhI3wsUInj"
947461470924820480,2017-12-31 13:36:32,Why would smart voters want to put Democrats in Congress in 2018 Election when their policies will totally kill the… https://t.co/u7zgBWSLMY
947458942719979520,2017-12-31 13:26:29,"If the Dems (Crooked Hillary) got elected, your stocks would be down 50% from values on Election Day. Now they have… https://t.co/eJOxPGScHK"
947453152806297600,2017-12-31 13:03:29,Big protests in Iran. The people are finally getting wise as to how their money and wealth is being stolen and squa… https://t.co/3AhXkVG6Lh
947328044821336070,2017-12-31 04:46:21,“Trump Rally: Stocks put 2017 in the record books” https://t.co/0foQGaFjMh
947236393184628741,2017-12-30 22:42:09,Jobs are kicking in and companies are coming back to the U.S. Unnecessary regulations and high taxes are being dram… https://t.co/ts9xxdjQzU
947235015343202304,2017-12-30 22:36:41,"I use Social Media not because I like to, but because it is the only way to fight a VERY dishonest and unfair “pres… https://t.co/1YTuk89nmu"
947213895286054914,2017-12-30 21:12:45,"On Taxes: “This is the biggest corporate rate cut ever, going back to the corporate income tax rate of roughly 80 y… https://t.co/xTHIVribyK"
947181212468203520,2017-12-30 19:02:53,"Oppressive regimes cannot endure forever, and the day will come when the Iranian people will face a choice. The wor… https://t.co/efPOuFh5fT"
947180713236934657,2017-12-30 19:00:54,"The entire world understands that the good people of Iran want change, and, other than the vast military power of t… https://t.co/oJmf2sgH6y"
946949708915924994,2017-12-30 03:42:58,Many reports of peaceful protests by Iranian citizens fed up with regime’s corruption &amp; its squandering of the nati… https://t.co/bL9JMWQ6bZ
946731576687235072,2017-12-29 13:16:11,"The Democrats have been told, and fully understand, that there can be no DACA without the desperately needed WALL a… https://t.co/sjkgrE1kQe"
946728546633953285,2017-12-29 13:04:09,"Why is the United States Post Office, which is losing many billions of dollars a year, while charging Amazon and ot… https://t.co/fHKlK5bmUe"
946725057384108033,2017-12-29 12:50:17,"RT @charliekirk11: Incredible video: @CBS does a special on the GOP tax plan 

The result?

Every middle class family they sat down with SA…"
946724984218669056,2017-12-29 12:50:00,"RT @charliekirk11: ISIS getting slaughtered: 

Square miles liberated from ISIS
Trump: 26,000 --  Obama: 13,200

Total Square miles held by…"
946724719956578304,2017-12-29 12:48:57,"RT @FoxBusiness: .@charliekirk11: ""What this president has done is truly historic, and if a Democrat president achieved 1/10th of what @POT…"
946724543774765056,2017-12-29 12:48:15,"RT @charliekirk11: 3 big wins in 2017 you won't hear:

Trump confirmed the most circuit court judges ever in a President's 1st year (all co…"
946724075157651457,2017-12-29 12:46:23,"While the Fake News loves to talk about my so-called low approval rating, @foxandfriends just showed that my rating… https://t.co/u3cMWTck6M"
946531657229701120,2017-12-29 00:01:47,"In the East, it could be the COLDEST New Year’s Eve on record. Perhaps we could use a little bit of that good old G… https://t.co/tCjF8xdXep"
946519720450252800,2017-12-28 23:14:21,"Together, we are MAKING AMERICA GREAT AGAIN! https://t.co/OeyTdFyl1Q https://t.co/wdLQkfdy4m"
946505517417095168,2017-12-28 22:17:55,"RT @realDonaldTrump: “Arrests of MS-13 Members, Associates Up 83% Under Trump” 
https://t.co/70iPHy2Yqn"
946505439939911685,2017-12-28 22:17:36,"RT @DanScavino: Congratulations to the 2017 @PinstripeBowl (Yankee Stadium) Champions, Iowa @HawkeyeFootball! https://t.co/NlaWU6bKmH"
946505312164630530,2017-12-28 22:17:06,"RT @EricTrump: #ThrowbackThursdays 
@realDonaldTrump 🇺🇸🇺🇸🇺🇸 https://t.co/Z44IObGZ7V"
946505155809247232,2017-12-28 22:16:29,RT @IvankaTrump: “The Trump economy is booming.” One thing @realDonaldTrump “has done that has received little attention despite arguably d…
946460939578167296,2017-12-28 19:20:47,"I've been saying it for a long, long time. #NoKo https://t.co/LQl7tGhMdO"
946416486054285314,2017-12-28 16:24:08,Caught RED HANDED - very disappointed that China is allowing oil to go into North Korea. There will never be a frie… https://t.co/aIa4CFXNoA
946415026402988033,2017-12-28 16:18:20,Retail sales are at record numbers. We’ve got the economy going better than anyone ever dreamt - and you haven’t seen anything yet!
946401576381505536,2017-12-28 15:24:53,"Vanity Fair, which looks like it is on its last legs, is bending over backwards in apologizing for the minor hit th… https://t.co/Sx6AmzfKRp"
946210723528572930,2017-12-28 02:46:30,"“Arrests of MS-13 Members, Associates Up 83% Under Trump” 
https://t.co/70iPHy2Yqn"
946201376652169220,2017-12-28 02:09:22,"“On 1/20 - the day Trump was inaugurated - an estimated 35,000 ISIS fighters held approx 17,500 square miles of ter… https://t.co/xnR1mXhmr3"
946156544927977477,2017-12-27 23:11:13,Just left West Palm Beach Fire &amp; Rescue #2. Met with great men and women as representatives of those who do so much… https://t.co/UK0Q7BUKbj
945780569388015616,2017-12-26 22:17:14,"All signs are that business is looking really good for next year, only to be helped further by our Tax Cut Bill. Wi… https://t.co/f37VETYLej"
945646491955290113,2017-12-26 13:24:27,"WOW, @foxandfrlends  “Dossier is bogus. Clinton Campaign, DNC funded Dossier. FBI CANNOT (after all of this time) V… https://t.co/3Lv4EhnuwV"
945624910898122752,2017-12-26 11:58:42,Based on the fact that the very unfair and unpopular Individual Mandate has been terminated as part of our Tax Cut… https://t.co/sZ3YczC3mR
945437479863291904,2017-12-25 23:33:55,"I hope everyone is having a great Christmas, then tomorrow it’s back to work in order to Make America Great Again (… https://t.co/JJ2tiWwe9V"
945436206267060226,2017-12-25 23:28:51,RT @EricTrump: We should all take a moment to say a prayer for those who paid the ultimate price  — Their bravery and sacrifice allows us t…
945287222210781184,2017-12-25 13:36:51,MERRY CHRISTMAS!!! https://t.co/mYtV5GNdLl
945140007572004870,2017-12-25 03:51:52,MERRY CHRISTMAS!! https://t.co/xa2qxcisVV
945126026824298497,2017-12-25 02:56:19,People are proud to be saying Merry Christmas again. I am proud to have led the charge against the assault of our c… https://t.co/TDmO0lcYHA
945030174290186241,2017-12-24 20:35:26,"The Tax Cut/Reform Bill, including Massive Alaska Drilling and the Repeal of the highly unpopular Individual Mandat… https://t.co/KgKnGzK6md"
944927689638662145,2017-12-24 13:48:11,The Fake News refuses to talk about how Big and how Strong our BASE is. They show Fake Polls just like they report… https://t.co/hNmVwpHtM1
944908467499884544,2017-12-24 12:31:48,RT @shawgerald4: @realDonaldTrump Thank you President TRUMP!! https://t.co/LKdkT0FL99
944906847970119680,2017-12-24 12:25:22,".@FoxNews-FBI’s Andrew McCabe, “in addition to his wife getting all of this money from M (Clinton Puppet), he was u… https://t.co/fRprD7LwtJ"
944703626454487042,2017-12-23 22:57:50,"Remember, the Republicans are 5-0 in Congressional races this year. In Senate, I said Roy M would lose in Alabama a… https://t.co/5IMirkPYFR"
944700332881440769,2017-12-23 22:44:45,The Stock Market is setting record after record and unemployment is at a 17 year low. So many things accomplished b… https://t.co/bctmAtxwb2
944667102312566784,2017-12-23 20:32:42,"Wow, “FBI lawyer James Baker reassigned,” according to @FoxNews."
944666448185692166,2017-12-23 20:30:06,FBI Deputy Director Andrew McCabe is racing the clock to retire with full benefits. 90 days to go?!!!
944665687292817415,2017-12-23 20:27:05,"How can FBI Deputy Director Andrew McCabe, the man in charge, along with leakin’ James Comey, of the Phony Hillary… https://t.co/9vYPo8QMbI"
944659788826324992,2017-12-23 20:03:39,RT @EricTrump: #JournalismIsDead  https://t.co/xZaJD5ADb7
944329684032081921,2017-12-22 22:11:56,"Remember, the most hated part of ObamaCare is the Individual Mandate, which is being terminated under our just signed Tax Cut Bill."
944308491887316992,2017-12-22 20:47:43,"Today, it was my great honor to sign the largest TAX CUTS and reform in the history of our country. Full remarks:… https://t.co/1plwmP1SX9"
944308373373308929,2017-12-22 20:47:15,"The United Nations Security Council just voted 15-0 in favor of additional Sanctions on North Korea. The World wants Peace, not Death!"
944276471614509057,2017-12-22 18:40:29,"Congressman Ron DeSantis is a brilliant young leader, Yale and then Harvard Law, who would make a GREAT Governor of… https://t.co/T3T1ayf1Vh"
944247868126318593,2017-12-22 16:46:49,"95% of Americans will pay less or, at worst, the same amount of taxes (mostly far less). The Dems only want to raise your taxes!"
944222979147337728,2017-12-22 15:07:55,Will be signing the biggest ever Tax Cut and Reform Bill in 30 minutes in Oval Office. Will also be signing a much… https://t.co/fgGbqDb0wg
944222157218942978,2017-12-22 15:04:39,"With all my Administration has done on Legislative Approvals (broke Harry Truman’s Record), Regulation Cutting, Jud… https://t.co/CukTyBYh5K"
944210183089254400,2017-12-22 14:17:04,“The President has accomplished some absolutely historic things during this past year.” Thank you Charlie Kirk of T… https://t.co/M7G4m0QqmO
944192071535153152,2017-12-22 13:05:06,"At some point, and for the good of the country, I predict we will start working with the Democrats in a Bipartisan… https://t.co/YVl8tAcSOk"
944188445748015105,2017-12-22 12:50:42,So true! https://t.co/1c8hu6O5t9
944187730564714497,2017-12-22 12:47:51,Our big and very popular Tax Cut and Reform Bill has taken on an unexpected new source of “love” - that is big comp… https://t.co/jnCQYxYQBh
943908041803657216,2017-12-21 18:16:28,"THANK YOU to everyone who joined me at the @WhiteHouse yesterday. Together, we are MAKING AMERICA GREAT AGAIN!… https://t.co/aykO3m2rVg"
943856675294982145,2017-12-21 14:52:22,"House Democrats want a SHUTDOWN for the holidays in order to distract from the very popular, just passed, Tax Cuts.… https://t.co/NRQRR8w3pp"
943842608631238656,2017-12-21 13:56:28,Home Sales hit BEST numbers in 10 years! MAKE AMERICA GREAT AGAIN
943824695144697857,2017-12-21 12:45:17,Was @foxandfriends just named the most influential show in news? You deserve it - three great people! The many Fake… https://t.co/43JVSDZSt6
943819430735372289,2017-12-21 12:24:22,"The Massive Tax Cuts, which the Fake News Media is desperate to write badly about so as to please their Democrat bo… https://t.co/9RZmBbjPQo"
943598090069536768,2017-12-20 21:44:50,WE ARE MAKING AMERICA GREAT AGAIN! https://t.co/HY353gXV0R
943543958730309633,2017-12-20 18:09:44,"We are delivering HISTORIC TAX RELIEF for the American people!
#TaxCutsandJobsAct https://t.co/lLgATrCh5o"
943534069287194626,2017-12-20 17:30:26,"Together, we are MAKING AMERICA GREAT AGAIN! https://t.co/47k9i4p3J2"
943521141062238208,2017-12-20 16:39:04,I would like to congratulate @SenateMajLdr on having done a fantastic job both strategically &amp; politically on the p… https://t.co/XkEvQ5GTGi
943489378462130176,2017-12-20 14:32:51,"The Tax Cuts are so large and so meaningful, and yet the Fake News is working overtime to follow the lead of their… https://t.co/TKdgQwixwF"
943362605258813441,2017-12-20 06:09:06,The United States Senate just passed the biggest in history Tax Cut and Reform Bill. Terrible Individual Mandate (O… https://t.co/uK5NUk2Ymo
943213901625294849,2017-12-19 20:18:12,"Congratulations to Paul Ryan, Kevin McCarthy, Kevin Brady, Steve Scalise, Cathy McMorris Rodgers and all great Hous… https://t.co/DjSHn7C6bL"
943135588496093190,2017-12-19 15:07:01,A  story in the @washingtonpost that I was close to “rescinding” the nomination of Justice Gorsuch prior to confirm… https://t.co/wu6B3WTgX0
943079382163353600,2017-12-19 11:23:40,Stocks and the economy have a long way to go after the Tax Cut Bill is totally understood and appreciated in scope… https://t.co/2BJwFD1CTu
943074475209355264,2017-12-19 11:04:11,DOW RISES 5000 POINTS ON THE YEAR FOR THE FIRST TIME EVER - MAKE AMERICA GREAT AGAIN!
942921051721338880,2017-12-19 00:54:32,"Together, our task is to strengthen our families, to build up our communities, to serve our citizens, and to celebr… https://t.co/QsOYvl1MXs"
942904686125965312,2017-12-18 23:49:30,"With the strategy that I announced today, we are declaring that AMERICA is in the game and AMERICA is DETERMINED to… https://t.co/PCdvaFyy2D"
942883507868782592,2017-12-18 22:25:20,70 Record Closes for the Dow so far this year! We have NEVER had 70 Dow Records in a one year period. Wow!
942882250089271297,2017-12-18 22:20:20,Thank you Maria B! https://t.co/v1UR63CqLK
942881716913438720,2017-12-18 22:18:13,So true Ivanka! https://t.co/BNGUJG69Ki
942857031693799425,2017-12-18 20:40:08,"As the world watches, we are days away from passing HISTORIC TAX CUTS for American families and businesses. It will… https://t.co/95522wIKVN"
942854056162332677,2017-12-18 20:28:19,"When the American People speak, ALL OF US should listen. Just over one year ago, you spoke loud and clear. On Novem… https://t.co/p8hGEg9j3v"
942851788461563906,2017-12-18 20:19:18,"Over the past 11 months, I have travelled tens of thousands of miles, to visit 13 countries. I have met with more t… https://t.co/ZUveaJ7Hv2"
942840800853024770,2017-12-18 19:35:38,Our deepest sympathies and most heartfelt prayers are with the victims of the train derailment in Washington State.… https://t.co/kPYFsuSKL7
942829676699021312,2017-12-18 18:51:26,"My thoughts and prayers are with everyone involved in the train accident in DuPont, Washington. Thank you to all of… https://t.co/kw24I2Jm9t"
942827072824672262,2017-12-18 18:41:05,"The train accident that just occurred in DuPont, WA shows more than ever why our soon to be submitted infrastructur… https://t.co/K1e1absbxG"
942721681130483712,2017-12-18 11:42:18,Ivanka Trump will be interviewed on @foxandfriends.
942717030091943936,2017-12-18 11:23:49,"Remember, Republicans are 5-0 in Congressional Races this year. The media refuses to mention this. I said Gillespie… https://t.co/AmcJkgOSRk"
942551516564639744,2017-12-18 00:26:07,"More than a century after conquering flight, the #WrightBrothers continue to motivate &amp; inspire Americans, who neve… https://t.co/QPzu1tZjLZ"
942503059103604736,2017-12-17 21:13:34,Wonderful weekend at Camp David. A very special place. A lot of very important work done. Heading back to the… https://t.co/jN86UYnzYa
942439739264831488,2017-12-17 17:01:58,"As a candidate, I promised we would pass a massive TAX CUT for the everyday working American families who are the b… https://t.co/sTAoTR50EF"
942130137734242305,2017-12-16 20:31:43,WEEKLY ADDRESS🇺🇸 https://t.co/1sH20Hb33x
942123433873281024,2017-12-16 20:05:05,"TAX CUTS will increase investment in the American economy and in U.S. workers, leading to higher growth, higher wag… https://t.co/BL5ONhuHIb"
942044657613230080,2017-12-16 14:52:03,"Congratulations to two great and hardworking guys, Corey Lewandowski and David Bossie, on the success of their just… https://t.co/UdHao5fSzB"
941868639199916037,2017-12-16 03:12:37,"Great job Kevin, we are all proud of you! https://t.co/K6hEEaOxKt"
941867829397254144,2017-12-16 03:09:24,"RT @RepKristiNoem: A lot of tough decisions got us to this point, but we’re closer than we’ve been in 30+ years to a fairer tax code that k…"
941867753677426688,2017-12-16 03:09:06,"RT @SpeakerRyan: For individuals and families, the final Tax Cuts &amp; Jobs Act:
✔lowers individual taxes
✔nearly doubles the standard deducti…"
941867661310545920,2017-12-16 03:08:44,RT @PressSec: .@POTUS historic tax cuts + doubling of the child tax credit will do infinitely more to empower working moms than liberals' p…
941820213518938112,2017-12-16 00:00:11,"DOW, S&amp;P 500 and NASDAQ close at record highs! #MAGA https://t.co/hvqwnqSGuG"
941789515248750592,2017-12-15 21:58:12,"Today, it was my tremendous honor to visit Marine Helicopter Squadron One (HMX-1) at the Marine Corps Air Facility… https://t.co/EUYbJAie51"
941756992070307845,2017-12-15 19:48:58,"You are always there for us – THE MEN AND WOMEN IN BLUE.

Thank you to our police, thank you to our sheriffs, and t… https://t.co/XGgLASUpMm"
941723524921724928,2017-12-15 17:35:59,"To each member of the graduating class from the National Academy at Quantico, CONGRATULATIONS! https://t.co/bGT8S33ZLU"
941667918214987776,2017-12-15 13:55:01,It was my honor. THANK YOU! https://t.co/1LvqbRQ1bi
941449449850761217,2017-12-14 23:26:54,RT @GOPChairwoman: .@realDonaldTrump is the Paycheck President. Learn how the tax bill will put more money in your pocket &amp; how to contact…
941417725833998340,2017-12-14 21:20:51,“Manufacturing Optimism Rose to Another All-Time High in the Latest @ShopFloorNAM Outlook Survey” https://t.co/LuV4BMp0Xc
941406242785955841,2017-12-14 20:35:13,"In 1960, there were approximately 20,000 pages in the Code of Federal Regulations. Today there are over 185,000 pag… https://t.co/rZFkxL4QJM"
941404173433794561,2017-12-14 20:27:00,"When Americans are free to thrive, innovate, &amp; prosper, there is no challenge too great, no task too large, &amp; no go… https://t.co/FaGl53u1Db"
941400670766321666,2017-12-14 20:13:04,"Today, we gathered in the Roosevelt Room for one single reason: to CUT THE RED TAPE! For many decades, an ever-grow… https://t.co/Cj9e2IzI81"
941353395121741825,2017-12-14 17:05:13,"As a candidate, I promised we would pass a massive tax cut for the everyday, working Americans. If you make your vo… https://t.co/NMVG40PWj8"
941291666564141057,2017-12-14 12:59:56,"Republican Tax Cuts are looking very good. All are working hard. In the meantime, the Stock Market hit another record high!"
941094961482780672,2017-12-13 23:58:18,Thank you Omarosa for your service! I wish you continued success.
940955920967880704,2017-12-13 14:45:48,"If last night’s election proved anything, it proved that we need to put up GREAT Republican candidates to increase… https://t.co/H4IWrlwWwl"
940930017365778432,2017-12-13 13:02:52,"Wow, more than 90% of Fake News Media coverage of me is negative, with numerous forced retractions of untrue storie… https://t.co/nyZJca6Hnm"
940904649728708609,2017-12-13 11:22:04,"The reason I originally endorsed Luther Strange (and his numbers went up mightily), is that I said Roy Moore will n… https://t.co/DcgJPmLTXy"
940795587733151744,2017-12-13 04:08:41,"Congratulations to Doug Jones on a hard fought victory. The write-in votes played a very big factor, but a win is a… https://t.co/QLFQ88UaLM"
940706127309926400,2017-12-12 22:13:12,Wishing all of those celebrating #Hanukkah around the world a happy and healthy eight nights in the company of thos… https://t.co/ZTNEFIV6cB
940588025964265472,2017-12-12 14:23:55,"Consumer Confidence is at an All-Time High, along with a Record High Stock Market. Unemployment is at a 17 year low… https://t.co/zeDQbntlYG"
940584383605563392,2017-12-12 14:09:26,"The people of Alabama will do the right thing. Doug Jones is Pro-Abortion, weak on Crime, Military and Illegal Immi… https://t.co/yv1IbXRYEj"
940567812053053441,2017-12-12 13:03:35,"Lightweight Senator Kirsten Gillibrand, a total flunky for Chuck Schumer and someone who would come to my office “b… https://t.co/L8fAyMgZ8M"
940554567414091776,2017-12-12 12:10:58,"Despite thousands of hours wasted and many millions of dollars spent, the Democrats have been unable to show any co… https://t.co/7KG6xKANGL"
940223974985871360,2017-12-11 14:17:18,"Another false story, this time in the Failing @nytimes, that I watch 4-8 hours of television a day - Wrong!  Also,… https://t.co/DMSmsmDUkF"
939967625362276354,2017-12-10 21:18:40,Very little discussion of all the purposely false and defamatory stories put out this week by the Fake News Media.… https://t.co/R8tTxg9AvK
939851058788134913,2017-12-10 13:35:28,Getting closer and closer on the Tax Cut Bill. Shaping up even better than projected. House and Senate working very… https://t.co/fKLVfqSmsK
939849867438034944,2017-12-10 13:30:44,"Things are going really well for our economy, a subject the Fake News spends as little time as possible discussing!… https://t.co/hZfaovKX9L"
939680422493073408,2017-12-10 02:17:25,No American should be separated from their loved ones because of preventable crime committed by those illegally in… https://t.co/leuQTYO8zk
939642796289470464,2017-12-09 23:47:55,Great Army - Navy Game. Army wins 14 to 13 and brings home the COMMANDER-IN-CHIEF’S TROPHY! Congratulations!
939634404267380736,2017-12-09 23:14:34,.@daveweigel of the Washington Post just admitted that his picture was a FAKE (fraud?) showing an almost empty aren… https://t.co/wERMFP0Wcp
939616077356642304,2017-12-09 22:01:44,".@DaveWeigel @WashingtonPost put out a phony photo of an empty arena hours before I arrived @ the venue, w/ thousan… https://t.co/3sbs38FyaF"
939564681743814661,2017-12-09 18:37:31,"Have a great game today, @USArmy and @USNavy - I will be watching. 

We love our U.S. Military. On behalf of an ent… https://t.co/zUH67y7RCl"
939560154269405184,2017-12-09 18:19:31,It was my great honor to celebrate the opening of two extraordinary museums-the Mississippi State History Museum &amp;… https://t.co/IN7JWc6lmT
939521466634326016,2017-12-09 15:45:47,"Heading to the great state of Mississippi at the invitation of their popular and respected Governor, @PhilBryantMS.… https://t.co/GcwoRmwaHp"
939485131693322240,2017-12-09 13:21:24,"CNN’S slogan is CNN, THE MOST TRUSTED NAME IN NEWS. Everyone knows this is not true, that this could, in fact, be a… https://t.co/FoPRXAVjsh"
939480342779580416,2017-12-09 13:02:23,"Fake News CNN made a vicious and purposeful mistake yesterday. They were caught red handed, just like lonely Brian… https://t.co/8OH18LzYbT"
939477807813595136,2017-12-09 12:52:18,A big contingent of very enthusiastic Roy Moore fans at the rally last night. We can’t have a Pelosi/Schumer Libera… https://t.co/XHOCKzdEh6
939475127552618496,2017-12-09 12:41:39,"GREAT EVENING last night in Pensacola, Florida. Arena was packed to the rafters, the crowd was loud, loving and rea… https://t.co/I0mrbhZT3g"
939375570919612416,2017-12-09 06:06:03,"We believe that every American should stand for the National Anthem, and we proudly pledge allegiance to one NATION… https://t.co/4GQmdSmiRk"
939355447273906182,2017-12-09 04:46:05,"This is your land, this is your home, and it's your voice that matters the most. So speak up, be heard, and fight,… https://t.co/u09Brwnow3"
939299624875118592,2017-12-09 01:04:16,Just arrived at the Pensacola Bay Center. Join me LIVE on @FoxNews in 10 minutes! #MAGA https://t.co/RQFqOkcpNV
939274666404909056,2017-12-08 23:25:06,"On my way to Pensacola, Florida. See everyone soon! #MAGA https://t.co/ijwxVSYQ52"
939208571253862400,2017-12-08 19:02:27,"“The unemployment rate remains at a 17-year low of 4.1%. The unemployment rate in manufacturing dropped to 2.6%, th… https://t.co/ujuFLRG8lc"
939189419386470401,2017-12-08 17:46:21,MAKE AMERICA GREAT AGAIN! https://t.co/64a93S07s7
939152197090148352,2017-12-08 15:18:27,Fines and penalties against Wells Fargo Bank for their bad acts against their customers and others will not be drop… https://t.co/Eg8RsLwJfA
939149296389251072,2017-12-08 15:06:55,LAST thing the Make America Great Again Agenda needs is a Liberal Democrat in Senate where we have so little margin… https://t.co/HaMncvh3Nc
939120304542101505,2017-12-08 13:11:43,"Big crowd expected today in Pensacola, Florida, for a Make America Great Again speech. We have done so much in so s… https://t.co/m4BiON3oo8"
939006911629869056,2017-12-08 05:41:08,I fulfilled my campaign promise - others didn’t! https://t.co/bYdaOHmPVJ
939005659982348291,2017-12-08 05:36:09,"Tonight, @FLOTUS Melania and I were thrilled to welcome so many wonderful friends to the @WhiteHouse – and wish the… https://t.co/NlHEGuiWCF"
938878398608433152,2017-12-07 21:10:28,"Across the battlefields, oceans, and harrowing skies of Europe and the Pacific throughout the war, one great battle… https://t.co/XelKHx4Ibo"
