id,created_at,text
826041397232943104,2017-01-30 12:16:30,"Only 109 people out of 325,000 were detained and held for questioning. Big problems at airports were caused by Delta computer outage,....."
825850987348914184,2017-01-29 23:39:53,I will be interviewed by @TheBrodyFile on @CBNNews tonight at 11pm. Enjoy!
825848204633731074,2017-01-29 23:28:50,Statement Regarding Recent Executive Order Concerning Extreme Vetting: https://t.co/f6JO60I0Ul
825823217025691648,2017-01-29 21:49:32,"...Senators should focus their energies on ISIS, illegal immigration and border security instead of always looking to start World War III."
825822320128303110,2017-01-29 21:45:58,The joint statement of former presidential candidates John McCain &amp; Lindsey Graham is wrong - they are sadly weak on immigration. The two...
825721153142521858,2017-01-29 15:03:58,Christians in the Middle-East have been executed in large numbers. We cannot allow this horror to continue!
825692045532618753,2017-01-29 13:08:18,"Our country needs strong borders and extreme vetting, NOW. Look what is happening all over Europe and, indeed, the world - a horrible mess!"
825690087857995776,2017-01-29 13:00:32,Somebody with aptitude and conviction should buy the FAKE NEWS and failing @nytimes and either run it correctly or let it fold with dignity!
825368580325773312,2017-01-28 15:42:58,"Today, we remember the crew of the Space Shuttle Challenger, 31 years later. #NeverForget https://t.co/OhshQsFRfl"
825331665509691393,2017-01-28 13:16:17,"...dwindling subscribers and readers.They got me wrong right from the beginning and still have not changed course, and never will. DISHONEST"
825329757646618624,2017-01-28 13:08:42,Thr coverage about me in the @nytimes and the @washingtonpost gas been so false and angry that the times actually apologized to its.....
825328817833123840,2017-01-28 13:04:58,"The failing @nytimes has been wrong about me from the very beginning. Said I would lose the primaries, then the general election. FAKE NEWS!"
825127844066054144,2017-01-27 23:46:22,I promise that our administration will ALWAYS have your back. We will ALWAYS be with you! https://t.co/D0aOWhOH4X
825101272982355968,2017-01-27 22:00:47,Congratulations Secretary Mattis! https://t.co/mkuhbegzqS
825075972659613696,2017-01-27 20:20:15,Statement on International Holocaust Remembrance Day: https://t.co/KjU0MOxCHk
825018149397463040,2017-01-27 16:30:29,.@VP Mike Pence will be speaking at today's #MarchForLife -- You have our full support! https://t.co/1jb53SEGV4
825017279209410561,2017-01-27 16:27:02,The #MarchForLife is so important. To all of you marching --- you have my full support!
824970003153842176,2017-01-27 13:19:10,"Mexico has taken advantage of the U.S. for long enough. Massive trade deficits &amp; little help on the very weak border must change, NOW!"
824968416486387713,2017-01-27 13:12:52,"Look forward to seeing final results of VoteStand. Gregg Phillips and crew say at least 3,000,000 votes were illegal. We must do better!"
824767281146245120,2017-01-26 23:53:37,Miami-Dade Mayor drops sanctuary policy. Right decision. Strong! https://t.co/MtPvaDC4jM
824765229527605248,2017-01-26 23:45:28,Will be interviewed by @SeanHannity on @FoxNews at 10:00pm tonight. Enjoy!
824698743630995457,2017-01-26 19:21:17,"Spoke at the Congressional @GOP Retreat in Philadelphia, PA. this afternoon w/ @VP, @SenateMajLdr, @SpeakerRyan. Th… https://t.co/ALSADGrwoe"
824616644370714627,2017-01-26 13:55:03,"of jobs and companies lost. If Mexico is unwilling to pay for the badly needed wall, then it would be better to cancel the upcoming meeting."
824615820391305216,2017-01-26 13:51:46,The U.S. has a 60 billion dollar trade deficit with Mexico. It has been a one-sided deal from the beginning of NAFTA with massive numbers...
824573698774601729,2017-01-26 11:04:24,"Ungrateful TRAITOR Chelsea Manning, who should never have been released from prison, is now calling President Obama a weak leader. Terrible!"
824448880993509376,2017-01-26 02:48:25,Interview with David Muir of @ABC News in 10 minutes. Enjoy!
824448156935081984,2017-01-26 02:45:32,"""@romoabcnews: .@DavidMuir first @POTUS interview since taking office.  Tonight on @ABCWorldNews @ABC2020 tonight. https://t.co/I4Vz1mRdBK"""
824440456813707265,2017-01-26 02:14:56,"As your President, I have no higher duty than to protect the lives of the American people. https://t.co/o7YNUNwb8f"
824407390674157568,2017-01-26 00:03:33,"Beginning today, the United States of America gets back control of its borders. Full speech from today @DHSgov:… https://t.co/8aDaHsAhg9"
824377804590563339,2017-01-25 22:05:59,I will be interviewed by @DavidMuir tonight at 10 o'clock on @ABC. Will be my first interview from the White House.… https://t.co/4zuOrRdcoc
824229586091307008,2017-01-25 12:17:01,I will be making my Supreme Court pick on Thursday of next week.Thank you!
824228768227217408,2017-01-25 12:13:46,"even, those registered to vote who are dead (and many for a long time). Depending on results, we will strengthen up voting procedures!"
824227824903090176,2017-01-25 12:10:01,"I will be asking for a major investigation into VOTER FRAUD, including those registered to vote in two states, those who are illegal and...."
824083821889015809,2017-01-25 02:37:48,"Big day planned on NATIONAL SECURITY tomorrow. Among many other things, we will build the wall!"
824080766288228352,2017-01-25 02:25:40,"If Chicago doesn't fix the horrible ""carnage"" going on, 228 shootings in 2017 with 42 killings (up 24% from 2016), I will send in the Feds!"
824078417213747200,2017-01-25 02:16:19,Congratulations to @FoxNews for being number one in inauguration ratings. They were many times higher than FAKE NEWS @CNN - public is smart!
824055927200423936,2017-01-25 00:46:57,Great meeting with Ford CEO Mark Fields and General Motors CEO Mary Barra at the @WhiteHouse today. https://t.co/T0eIgO6LP8
823950814163140609,2017-01-24 17:49:17,Signing orders to move forward with the construction of the Keystone XL and Dakota Access pipelines in the Oval Off… https://t.co/aOxmfO0vOK
823939422743830528,2017-01-24 17:04:01,"Great meeting with automobile industry leaders at the @WhiteHouse this morning. Together, we will #MAGA! https://t.co/OXdiLOkGsZ"
823937936056008704,2017-01-24 16:58:06,A photo delivered yesterday that will be displayed in the upper/lower press hall. Thank you Abbas! https://t.co/Uzp0ivvRp0
823850781946343427,2017-01-24 11:11:47,Will be meeting at 9:00 with top automobile executives concerning jobs in America. I want new plants to be built here for cars sold here!
823495059010109440,2017-01-23 11:38:16,Busy week planned with a heavy focus on jobs and national security. Top executives coming in at 9:00 A.M. to talk manufacturing in America.
823174199036542980,2017-01-22 14:23:17,"Peaceful protests are a hallmark of our democracy. Even if I don't always agree, I recognize the rights of people to express their views."
823151124815507460,2017-01-22 12:51:36,"Wow, television ratings just out: 31 million people watched the Inauguration, 11 million more than the very good ratings from 4 years ago!"
823150055418920960,2017-01-22 12:47:21,Watched protests yesterday but was under the impression that we just had an election! Why didn't these people vote? Celebs hurt cause badly.
823146987117772800,2017-01-22 12:35:09,"Had a great meeting at CIA Headquarters yesterday, packed house, paid great respect to Wall, long standing ovations, amazing people. WIN!"
822955565949272065,2017-01-21 23:54:31,"RT @WhiteHouse: ""Do not allow anyone to tell you that it cannot be done. No challenge can match the HEART and FIGHT and SPIRIT of America.""…"
822774162011910144,2017-01-21 11:53:41,A fantastic day and evening in Washington D.C.Thank you to @FoxNews and so many other news outlets for the GREAT reviews of the speech!
822669114237943808,2017-01-21 04:56:15,"THANK YOU for another wonderful evening in Washington, D.C. TOGETHER, we will MAKE AMERICA GREAT AGAIN🇺🇸 https://t.co/V3aoj9RUh4"
822507434396753921,2017-01-20 18:13:48,"TO ALL AMERICANS🇺🇸
https://t.co/D7Es6ie4fY"
822504142178500608,2017-01-20 18:00:43,"So to all Americans, in every city near and far, small and large, from mountain to mountain...https://t.co/cZKkrGXLSi"
822503558369181697,2017-01-20 17:58:24,It is time to remember that...https://t.co/ZKyOiOor62
822502887477673984,2017-01-20 17:55:44,"We will follow two simple rules: BUY AMERICAN &amp; HIRE AMERICAN!
#InaugurationDay #MAGA🇺🇸"
822502601304526848,2017-01-20 17:54:36,We will bring back our jobs. We will bring back our borders. We will bring back our wealth - and we will bring back our dreams!
822502450007515137,2017-01-20 17:54:00,"The forgotten men and women of our country will be forgotten no longer. From this moment on, it’s going to be #AmericaFirst🇺🇸"
822502270503972872,2017-01-20 17:53:17,"January 20th 2017, will be remembered as the day the people became the rulers of this nation again."
822502135233384448,2017-01-20 17:52:45,"What truly matters is not which party controls our government, but whether our government is controlled by the people."
822501939267141634,2017-01-20 17:51:58,"power from Washington, D.C. and giving it back to you, the American People. #InaugurationDay"
822501803615014918,2017-01-20 17:51:25,"Today we are not merely transferring power from one Administration to another, or from one party to another – but we are transferring..."
822421390125043713,2017-01-20 12:31:53,It all begins today! I will see you at 11:00 A.M. for the swearing-in. THE MOVEMENT CONTINUES - THE WORK BEGINS!
822298747421986828,2017-01-20 04:24:33,"Thank you for a wonderful evening in Washington, D.C. #Inauguration https://t.co/a6xpFQTHj5"
822242449053614081,2017-01-20 00:40:51,"Thank you for joining us at the Lincoln Memorial tonight- a very special evening! Together, we are going to MAKE AM… https://t.co/OSxa3BamHs"
822177206633955328,2017-01-19 20:21:36,"Join me at 4pm over at the Lincoln Memorial with my family!
#Inauguration2017 https://t.co/GQeQpJOgWz"
822176438627536897,2017-01-19 20:18:32,Great Concert at 4:00 P.M. today at Lincoln Memorial. Enjoy!
822175285151928320,2017-01-19 20:13:57,On my way! #Inauguration2017 https://t.co/hOuMbxGnpe
822066653953458177,2017-01-19 13:02:18,"the American people. I have no doubt that we will, together, MAKE AMERICA GREAT AGAIN!"
822066132307808256,2017-01-19 13:00:13,"Getting ready to leave for Washington, D.C. The journey begins and I will be working and fighting very hard to make it a great journey for.."
822064153426857984,2017-01-19 12:52:22,"""It wasn't Donald Trump that divided this country, this country has been divided for a long time!"" Stated today by Reverend Franklin Graham."
821930600290521089,2017-01-19 04:01:40,Thank you to our amazing Wounded Warriors for their service. It was an honor to be with them tonight in D.C.… https://t.co/Qj5cpfaykD
821898525432811520,2017-01-19 01:54:13,Great seeing @TheLeeGreenwood  and Kimberly at this evenings VP dinner! #GodBlessTheUSA https://t.co/SxVmaWvOFT
821844875268255744,2017-01-18 22:21:02,"Looking forward to a speedy recovery for George and Barbara Bush, both hospitalized. Thank you for your wonderful letter!"
821772494864580614,2017-01-18 17:33:25,"Writing my inaugural address at the Winter White House, Mar-a-Lago, three weeks ago. Looking forward to Friday.… https://t.co/J0ojOXjrga"
821719763214880769,2017-01-18 14:03:53,.@TheAlabamaBand was great last night in D.C. playing for 147 Diplomats and Ambassadors from countries around the world. Thanks Alabama!
821705440178348033,2017-01-18 13:06:58,No wonder the Today Show on biased @NBC is doing so badly compared to its glorious past. Little credibility!
821703902940827648,2017-01-18 13:00:51,"""Bayer AG has pledged to add U.S. jobs and investments after meeting with President-elect Donald Trump, the latest in a string..."" @WSJ"
821699672687448064,2017-01-18 12:44:03,"to the U.S., but had nothing to do with TRUMP, is more FAKE NEWS. Ask top CEO's of those companies for real facts. Came back because of me!"
821697182235496450,2017-01-18 12:34:09,"Totally biased @NBCNews went out of its way to say that the big announcement from Ford, G.M., Lockheed &amp; others that jobs are coming back..."
821686928680583169,2017-01-18 11:53:24,Will be interviewed by @ainsleyearhardt on @foxandfriends - Enjoy!
821446536278274050,2017-01-17 19:58:10,"RT @EricTrump: Thank you to @GolfDigest for this incredible feature! ""Golfer-in-Chief"" @RealDonaldTrump https://t.co/vpdY4jNbI4 https://t.c…"
821441044097224704,2017-01-17 19:36:21,"RT @MoskowitzEva: .@BetsyDeVos has the talent, commitment, and leadership capacity to revitalize our public schools and deliver the promise…"
821415698278875137,2017-01-17 17:55:38,Thank you to General Motors and Walmart for starting the big jobs push back into the U.S.!
821410947864653825,2017-01-17 17:36:45,"""How Trump Won--And How The Media Missed It"" https://t.co/Hfab41h65X"
821369651968012288,2017-01-17 14:52:39,"""thought it would be hypocritical to attend Bush's swearing-in....he doesn't believe Bush is the true elected president."" Sound familiar! WP"
821368088935432196,2017-01-17 14:46:27,"John Lewis said about my inauguration, ""It will be the first one that I've missed."" WRONG (or lie)! He boycotted Bush 43 also because he..."
821365569366671360,2017-01-17 14:36:26,"country and with the massive cost reductions I have negotiated on military purchases and more, I believe the people are seeing ""big stuff."""
821364027506966532,2017-01-17 14:30:19,"With all of the jobs I am bringing back into the U.S. (even before taking office), with all of the new auto plants coming back into our....."
821344302651555840,2017-01-17 13:11:56,"The same people who did the phony election polls, and were so wrong, are now doing approval rating polls. They are rigged just like before."
821342600322043905,2017-01-17 13:05:10,"People are pouring into Washington in record numbers. Bikers for Trump are on their way. It will be a great Thursday, Friday and Saturday!"
821177307708661761,2017-01-17 02:08:21,"""@drgoodspine: @realDonaldTrump @Ivanka Trump is great, a woman with real character and class."""
821172595869577220,2017-01-17 01:49:38,"At 9:00 P.M. @CNN, of all places, is doing a Special Report on my daughter, Ivanka. Considering it is CNN, can't imagine it will be great!"
821170750983995392,2017-01-17 01:42:18,"""@levisteveholt: @realDonaldTrump I appreciate your use of Twitter to keep us informed and maintain transparency."" Very dishonest media!"
820992721120854016,2017-01-16 13:54:52,Celebrate Martin Luther King Day and all of the many wonderful things that he stood for. Honor him for being the great man that he was!
820789938887294977,2017-01-16 00:29:05,"much worse - just look at Syria (red line), Crimea, Ukraine and the build-up of Russian nukes. Not good! Was this the leaker of Fake News?"
820786730257285120,2017-01-16 00:16:20,".@FoxNews ""Outgoing CIA Chief, John Brennan, blasts Pres-Elect Trump on Russia threat. Does not fully understand."" Oh really, couldn't do..."
820764134857969666,2017-01-15 22:46:33,".@NBCNews is bad but Saturday Night Live is the worst of NBC. Not funny, cast is terrible, always a complete hit job. Really bad television!"
820725491812487170,2017-01-15 20:13:00,"about that...Those Intelligence chiefs made a mistake here, &amp; when people make mistakes, they should APOLOGIZE."" Media should also apologize"
820723387995717632,2017-01-15 20:04:38,"Thank you to Bob Woodward who said, ""That is a garbage document...it never should have been presented...Trump's right to be upset (angry)..."
820707210565132288,2017-01-15 19:00:21,"For many years our country has been divided, angry and untrusting. Many say it will never change, the hatred is too deep. IT WILL CHANGE!!!!"
820632299037409280,2017-01-15 14:02:41,"will only get higher. Car companies and others, if they want to do business in our country, have to start making things here again. WIN!"
820631495660408835,2017-01-15 13:59:29,"The Democrats are most angry that so many Obama Democrats voted for me. With all of the jobs I am bringing back to our Nation, that number.."
820450166331346944,2017-01-15 01:58:57,"Inauguration Day is turning out to be even bigger than expected. January 20th, Washington D.C. Have fun!"
820425770925338624,2017-01-15 00:22:01,Congressman John Lewis should finally focus on the burning and crime infested inner-cities of the U.S. I can use all the help I can get!
820257714362314753,2017-01-14 13:14:13,"INTELLIGENCE INSIDERS NOW CLAIM THE TRUMP DOSSIER IS ""A COMPLETE FRAUD!""  @OANN"
820255947956383744,2017-01-14 13:07:12,"mention crime infested) rather than falsely complaining about the election results. All talk, talk, talk - no action or results. Sad!"
820251730407473153,2017-01-14 12:50:26,"Congressman John Lewis should spend more time on fixing and helping his district, which is in horrible shape and falling apart (not to......"
819962894616064001,2017-01-13 17:42:42,"A beautiful funeral today for a real NYC hero, Detective Steven McDonald. Our law enforcement community has my complete and total support."
819869953692155904,2017-01-13 11:33:24,"The ""Unaffordable"" Care Act will soon be history!"
819868066364461058,2017-01-13 11:25:54,have been allowed to run - guilty as hell. They were VERY nice to her. She lost because she campaigned in the wrong states - no enthusiasm!
819867246352801792,2017-01-13 11:22:38,What are Hillary Clinton's people complaining about with respect to the F.B.I. Based on the information they had she should never.....
819865802849587200,2017-01-13 11:16:54,"released by ""Intelligence"" even knowing there is no proof, and never will be. My people will have a full report on hacking within 90 days!"
819864373988573184,2017-01-13 11:11:13,"Totally made up facts by sleazebag political operatives, both Democrats and Republicans - FAKE NEWS! Russia says nothing exists. Probably..."
819863039902097408,2017-01-13 11:05:55,It now turns out that the phony allegations against me were put together by my political opponents and a failed spy afraid of being sued....
819858926455967744,2017-01-13 10:49:34,"All of my Cabinet nominee are looking good and doing a great job. I want them to be themselves and express their own thoughts, not mine!"
819600124133474307,2017-01-12 17:41:11,Congrats to the Senate for taking the first step to #RepealObamacare- now it's onto the House!
819550083742109696,2017-01-12 14:22:21,.@CNN is in a total meltdown with their FAKE NEWS because their ratings are tanking since election and their credibility will soon be gone!
819541997325316096,2017-01-12 13:50:13,Thank you to Linda Bean of L.L.Bean for your great support and courage. People will support you even more now. Buy L.L.Bean. @LBPerfectMaine
819520238446411777,2017-01-12 12:23:45,"James Clapper called me yesterday to denounce the false and fictitious report that was illegally circulated. Made up, phony facts.Too bad!"
819399723924803585,2017-01-12 04:24:52,"""@zhu_amy3: @realDonaldTrump It's Morning in America again!!!  ☀️☀️☀️Thank you President-Elect Donald Trump!!! So proud of you!!!!"" THANKS!"
819393877174087682,2017-01-12 04:01:38,We had a great News Conference at Trump Tower today. A couple of FAKE NEWS organizations were there but the people truly get what's going on
819164172781060096,2017-01-11 12:48:52,"Intelligence agencies should never have allowed this fake news to ""leak"" into the public. One last shot at me.Are we living in Nazi Germany?"
819162968592183298,2017-01-11 12:44:05,"I win an election easily, a great ""movement"" is verified, and crooked opponents try to belittle our victory with FAKE NEWS. A sorry state!"
819159806489591809,2017-01-11 12:31:31,"Russia has never tried to use leverage over me. I HAVE NOTHING TO DO WITH RUSSIA - NO DEALS, NO LOANS, NO NOTHING!"
819155311793700865,2017-01-11 12:13:40,"Russia just said the unverified report paid for by political opponents is ""A COMPLETE AND TOTAL FABRICATION, UTTER NONSENSE."" Very unfair!"
819000924207251456,2017-01-11 02:00:11,"'BuzzFeed Runs Unverifiable Trump-Russia Claims' #FakeNews 
https://t.co/d6daCFZHNh"
818994757569564673,2017-01-11 01:35:41,RT @MichaelCohen212: I have never been to Prague in my life. #fakenews https://t.co/CMil9Rha3D
818990655418617856,2017-01-11 01:19:23,FAKE NEWS - A TOTAL POLITICAL WITCH HUNT!
818948254943604736,2017-01-10 22:30:53,"'Trump Helps Lift Small Business Confidence to 12-Yr. High'
https://t.co/MhbABREhzt https://t.co/CWAvJ4fRdx"
818922995980845056,2017-01-10 20:50:31,'Small business optimism soars after Trump election' https://t.co/WjBaTp824U
818841421364989952,2017-01-10 15:26:22,"'U.S. Small-Business Optimism Index Surges by Most Since 1980'
https://t.co/X22x1BttdG"
818643528905621504,2017-01-10 02:20:01,"Thank you to all of the men and women who protect &amp; serve our communities 24/7/365! 
#LawEnforcementAppreciationDay… https://t.co/aqUbDipSgv"
818586286034485250,2017-01-09 22:32:33,An old picture with Nancy and Ronald Reagan. https://t.co/8kvQ1PzPAf
818461467766824961,2017-01-09 14:16:34,Ford said last week that it will expand in Michigan and U.S. instead of building a BILLION dollar plant in Mexico. Thank you Ford &amp; Fiat C!
818460862675558400,2017-01-09 14:14:10,"It's finally happening - Fiat Chrysler just announced plans to invest $1BILLION in Michigan and Ohio plants, adding 2000 jobs. This after..."
818422930157830144,2017-01-09 11:43:26,"""groveling"" when he totally changed a 16 year old story that he had written in order to make me look bad. Just more very dishonest media!"
818421066859167746,2017-01-09 11:36:02,"Hillary flunky who lost big. For the 100th time, I never ""mocked"" a disabled reporter (would never do that) but simply showed him......."
818419002548568064,2017-01-09 11:27:50,"Meryl Streep, one of the most over-rated actresses in Hollywood, doesn't know me but attacked last night at the Golden Globes. She is a....."
818416446527172608,2017-01-09 11:17:40,Rupert Murdoch is a great guy who likes me much better as a very successful candidate than he ever did as a very successful developer!
818307689323368448,2017-01-09 04:05:31,Dishonest media says Mexico won't be paying for the wall if they pay a little later so the wall can be built more quickly. Media is fake!
818169485169410048,2017-01-08 18:56:20,"Before I, or anyone, saw the classified and/or highly confidential hacking intelligence report, it was leaked out to @NBCNews. So serious!"
818139647687753733,2017-01-08 16:57:46,"RT @MeetThePress: Watch our interview with @KellyannePolls: Russia ""did not succeed"" in attempts to sway election https://t.co/EZhgUIUbYx #…"
818136714396975104,2017-01-08 16:46:07,Kellyanne Conway went to @MeetThePress this morning for an interview with @chucktodd. Dishonest media cut out 9 of her 10 minutes. Terrible!
818134981344165888,2017-01-08 16:39:14,"""@FoxNews: ""We certainly don’t want intelligence interfering with politics and we don’t want politics interfe… https://t.co/bwDjEg1d7S"""
818134360712953858,2017-01-08 16:36:46,"""@KellyannePolls: Welcome to President and Mrs. Bush.  
https://t.co/I1K4nj1gVu"" Very nice!"
817915516018892805,2017-01-08 02:07:09,"I look very much forward to meeting Prime Minister Theresa May in Washington in the Spring. Britain, a longtime U.S. ally, is very special!"
817882028272128001,2017-01-07 23:54:05,Congratulation to Jane Timken on her major upset victory in becoming the Ohio Republican Party Chair. Jane is a loyal Trump supporter &amp; star
817753083707015168,2017-01-07 15:21:42,"both countries will, perhaps, work together to solve some of the many great and pressing problems and issues of the WORLD!"
817750330196819968,2017-01-07 15:10:46,"have enough problems around the world without yet another one. When I am President, Russia will respect us far more than they do now and...."
817748207694467072,2017-01-07 15:02:20,"Having a good relationship with Russia is a good thing, not a bad thing. Only ""stupid"" people, or fools, would think that it is bad! We....."
817703208567078913,2017-01-07 12:03:31,Only reason the hacking of the poorly defended DNC is discussed is that the loss by the Dems was so big that they are totally embarrassed!
817701436096126977,2017-01-07 11:56:29,Intelligence stated very strongly there was absolutely no evidence that hacking affected the election results. Voting machines not touched!
817579925771341825,2017-01-07 03:53:38,Gross negligence by the Democratic National Committee allowed hacking to take place.The Republican National Committee had strong defense!
817522928862502913,2017-01-07 00:07:09,"Happy Birthday @EricTrump!
https://t.co/bJaEY7qFSn"
817453219613917185,2017-01-06 19:30:09,Monitoring the terrible situation in Florida. Just spoke to Governor Scott. Thoughts and prayers for all. Stay safe!
817413321058029568,2017-01-06 16:51:37,I am asking the chairs of the House and Senate committees to investigate top secret intelligence shared with NBC prior to me seeing it.
817374875962769408,2017-01-06 14:18:51,"Anna Wintour came to my office at Trump Tower to ask me to meet with the editors of Conde Nast &amp; Steven Newhouse, a friend. Will go this AM."
817350726800306177,2017-01-06 12:42:53,"being a movie star-and that was season 1 compared to season 14. Now compare him to my season 1. But who cares, he supported Kasich &amp; Hillary"
817348644647108609,2017-01-06 12:34:37,"Wow, the ratings are in and Arnold Schwarzenegger got ""swamped"" (or destroyed) by comparison to the ratings machine, DJT. So much for...."
817341196251070464,2017-01-06 12:05:01,"Hopefully, all supporters, and those who want to MAKE AMERICA GREAT AGAIN, will go to D.C. on January 20th. It will be a GREAT SHOW!"
