id,created_at,text
880534684479897600,2017-06-29 21:13:22,"""Mattis Says Trump’s Warning Stopped Chemical Weapons Attack In Syria"" https://t.co/XL9LLNKh8i"
880508977590697984,2017-06-29 19:31:13,"Join me LIVE with @VP, @SecretaryPerry, @SecretaryZinke and @EPAScottPruitt. 
#UnleashingAmericanEnergy
https://t.co/hlM7F2BQD9"
880489358431850496,2017-06-29 18:13:16,"MAKE AMERICA SAFE AGAIN!

#NoSanctuaryForCriminalsAct 
#KatesLaw #SaveAmericanLives 

https://t.co/jbN4hPjqjS"
880469342835666944,2017-06-29 16:53:44,"Today, the House votes on two crucial bills:
☑️#NoSanctuaryForCriminalsAct 
☑️#KatesLaw 
☑️Pass these bills &amp; lets… https://t.co/4N2c0oxMve"
880410114456465411,2017-06-29 12:58:23,"...to Mar-a-Lago 3 nights in a row around New Year's Eve, and insisted on joining me. She was bleeding badly from a face-lift. I said no!"
880408582310776832,2017-06-29 12:52:17,"I heard poorly rated @Morning_Joe speaks badly of me (don't watch anymore). Then how come low I.Q. Crazy Mika, along with Psycho Joe, came.."
880402366373269504,2017-06-29 12:27:35,New Sugar deal negotiated with Mexico is a very good one for both Mexico and the U.S. Had no deal for many years which hurt U.S. badly.
880242238000955392,2017-06-29 01:51:18,Tomorrow the House votes on #KatesLaw &amp; No Sanctuary For Criminals Act. Lawmakers must vote to put American safety… https://t.co/p3vd8IXXaD
880192282254872576,2017-06-28 22:32:47,"From my first day in office, we’ve taken swift action to lift the crushing restrictions on American energy. Remarks… https://t.co/VBoEubD59k"
880175585418465284,2017-06-28 21:26:27,Democrats purposely misstated Medicaid under new Senate bill - actually goes up. https://t.co/necCt4K6UH
880172859108331520,2017-06-28 21:15:37,"Today, I hosted an immigration roundtable ahead of two votes taking place in Congress tomorrow. Watch and read more… https://t.co/5k8WzW1t68"
880170602690215936,2017-06-28 21:06:39,It was my great honor to welcome the 2016 World Series Champion Chicago @Cubs ⚾️ to the @WhiteHouse this afternoon.… https://t.co/GvPhJ9hZdv
880158771762286592,2017-06-28 20:19:38,"#ICYMI- on Monday, I had the great honor of welcoming India's Prime Minister @narendramodi to the WH. Full Remarks:… https://t.co/7IIQEh7xXv"
880049704620494848,2017-06-28 13:06:14,"The #AmazonWashingtonPost, sometimes referred to as the guardian of Amazon not paying internet taxes (which they should) is FAKE NEWS!"
880018828603912194,2017-06-28 11:03:33,RT @foxandfriends: HAPPENING TODAY: House to vote on immigration bills including 'Kate’s Law' and 'No Sanctuary for Criminals Act' https://…
880017678978736129,2017-06-28 10:58:59,"Some of the Fake News Media likes to say that I am not totally engaged in healthcare. Wrong, I know the subject well &amp; want victory for U.S."
880015261004435456,2017-06-28 10:49:22,The failing @nytimes writes false story after false story about me. They don't even call to verify the facts of a story. A Fake News Joke!
879828637733793793,2017-06-27 22:27:48,"I just finished a great meeting with the Republican Senators concerning HealthCare. They really want to get it right, unlike OCare!"
879827411008974852,2017-06-27 22:22:55,"With ZERO Democrats to help, and a failed, expensive and dangerous ObamaCare as the Dems legacy, the Republican Senators are working hard!"
879682547235651584,2017-06-27 12:47:17,"So they caught Fake News CNN cold, but what about NBC, CBS &amp; ABC? What about the failing @nytimes &amp; @washingtonpost? They are all Fake News!"
879678356450676736,2017-06-27 12:30:38,Fake News CNN is looking at big management changes now that they got caught falsely pushing their phony Russian stories. Ratings way down!
879663665645056000,2017-06-27 11:32:15,"RT @ericbolling: Good morning friends!  ""The Swamp"" out today.  President Trump has a copy... get yours here https://t.co/TntLPNCCjR. #maga…"
879661481360588800,2017-06-27 11:23:35,RT @foxandfriends: President Trump officially nominates former Assistant Attorney General Christopher Wray to head the FBI https://t.co/ld7…
879660494218547202,2017-06-27 11:19:39,RT @foxandfriends: Another Dem 'queasy' over claim of Loretta Lynch meddling in Clinton case https://t.co/wdQ9MduxOO
879655772111679488,2017-06-27 11:00:53,RT @foxandfriends: Hannity: Russia allegations 'boomeranging back' on Democrats https://t.co/lvdrpxpcp9
879655576803913728,2017-06-27 11:00:07,RT @foxandfriends: Mark Levin: The collusion is among the Democrats https://t.co/Qrca7r01BI
879652031799205888,2017-06-27 10:46:02,RT @JeffTutorials: @realDonaldTrump  https://t.co/6sDcyiW4Kt
879648931172556802,2017-06-27 10:33:42,"Wow, CNN had to retract big story on ""Russia,"" with 3 employees forced to resign. What about all the other phony stories they do? FAKE NEWS!"
879527520957325314,2017-06-27 02:31:16,"Great day for America's future Security and Safety, courtesy of the U.S. Supreme Court. I will keep fighting for the American people, &amp; WIN!"
879525817361068032,2017-06-27 02:24:30,"From @FoxNews ""Bombshell: In 2016, Obama dismissed idea that anyone could rig an American election.""  Check out his statement - Witch Hunt!"
879512164553420809,2017-06-27 01:30:15,"RT @WhiteHouse: FACT: when #Obamacare was signed, CBO estimated that 23M would be covered in 2017. They were off by 100%. Only 10.3M people…"
879405223399350272,2017-06-26 18:25:18,Very grateful for the 9-O decision from the U. S. Supreme Court. We must keep America SAFE!
879403082114846722,2017-06-26 18:16:47,"RT @WhiteHouse: Today @POTUS will welcome the Prime Minister of India, @narendramodi, to the White House. https://t.co/MIi1ifmdAN"
879402984756711425,2017-06-26 18:16:24,RT @WhiteHouse: #Obamacare has led to higher costs and fewer health insurance options for millions of Americans. It has failed the American…
879326984794517507,2017-06-26 13:14:24,"Republican Senators are working very hard to get there, with no help from the Democrats. Not easy! Perhaps just let OCare crash &amp; burn!"
879324620159160322,2017-06-26 13:05:01,"..under a magnifying glass, they have zero ""tapes"" of T people colluding. There is no collusion &amp; no obstruction. I should be given apology!"
879323238425395200,2017-06-26 12:59:31,The real story is that President Obama did NOTHING after being informed in August about Russian meddling. With 4 months looking at Russia...
879320905608044544,2017-06-26 12:50:15,"...and did not want to ""rock the boat."" He didn't ""choke,"" he colluded or obstructed, and it did the Dems and Crooked Hillary no good."
879317636164841474,2017-06-26 12:37:16,The reason that President Obama did NOTHING about Russia after being notified by the CIA of meddling is that he expected Clinton would win..
879315860178993152,2017-06-26 12:30:12,"The Democrats have become nothing but OBSTRUCTIONISTS, they have no policies or ideas. All they do is delay and complain.They own ObamaCare!"
878946025662296064,2017-06-25 12:00:37,Hillary Clinton colluded with the Democratic Party in order to beat Crazy Bernie Sanders. Is she allowed to so collude? Unfair to Bernie!
878725385235701761,2017-06-24 21:23:52,MAKE AMERICA GREAT AGAIN!
878717095701336064,2017-06-24 20:50:56,I cannot imagine that these very fine Republican Senators would allow the American people to suffer a broken ObamaCare any longer!
878715504063643648,2017-06-24 20:44:36,"Obama Administration official said they ""choked"" when it came to acting on Russian meddling of election. They didn't want to hurt Hillary?"
878711517537083392,2017-06-24 20:28:46,"Since the Obama Administration was told way before the 2016 Election that the Russians were meddling, why no action? Focus on them, not T!"
878596457741287424,2017-06-24 12:51:33,"Democrats slam GOP healthcare proposal as Obamacare premiums &amp; deductibles increase by over 100%. Remember keep your doctor, keep your plan?"
878413313188802560,2017-06-24 00:43:48,Just out: The Obama Administration knew far in advance of November 8th about election meddling by Russia. Did nothing about it. WHY?
878365166538285057,2017-06-23 21:32:29,WEEKLY ADDRESS🇺🇸 https://t.co/P1f12i9Gvt
878341007103987712,2017-06-23 19:56:29,"Today, it was a tremendous honor for me to sign the #VAaccountability Act into law, delivering my campaign promise… https://t.co/G0k8nFWqNj"
878200921980891136,2017-06-23 10:39:50,"I've helped pass and signed 38 Legislative Bills, mostly with no Democratic support, and gotten rid of massive amounts of regulations. Nice!"
878192867847675904,2017-06-23 10:07:50,Will be on @foxandfriends. Enjoy!
878085811941539849,2017-06-23 03:02:26,RT @foxandfriends: POTUS the predictor? President Trump foretold housing upswing in 2012 https://t.co/N3LMDZKTK1
878085201494147076,2017-06-23 03:00:00,RT @foxnation: .@SenTedCruz: I want to Get to a 'Yes' Vote: https://t.co/g0vafw4ef2
878078560715538432,2017-06-23 02:33:37,.@FLOTUS &amp; I were honored to host our first WH Congressional Picnic. A wonderful evening &amp; tradition. @MarineBand:… https://t.co/h5L4myWmam
878031806506848256,2017-06-22 23:27:50,We're all thinking of you @SteveScalise! #TeamScalise https://t.co/Yqf6exhm7x
878027873650475008,2017-06-22 23:12:12,"Together, we are going to MAKE AMERICA GREAT AGAIN!
#AmericaFirst🇺🇸 https://t.co/MVJbs44AtR"
878019881353871360,2017-06-22 22:40:27,"I am very supportive of the Senate #HealthcareBill. Look forward to making it really special! Remember, ObamaCare is dead."
878013639613186049,2017-06-22 22:15:39,"Mexico was just ranked the second deadliest country in the world, after only Syria. Drug trade is largely the cause. We will BUILD THE WALL!"
878006964072189952,2017-06-22 21:49:07,"As promised, our campaign against the MS-13 gang continues. 

""@ICEgov Busts 39 MS-13 Members in New York Operation""
https://t.co/ki41GXeCMy"
877932956458795008,2017-06-22 16:55:02,"...whether there are ""tapes"" or recordings of my conversations with James Comey, but I did not make, and do not have, any such recordings."
877932907137966080,2017-06-22 16:54:50,"With all of the recently reported electronic surveillance, intercepts, unmasking and illegal leaking of information, I have no idea..."
877892883352702976,2017-06-22 14:15:48,I certainly hope the Democrats do not force Nancy P out. That would be very bad for the Republican Party - and please let Cryin' Chuck stay!
877891129194102785,2017-06-22 14:08:50,"...Why did the DNC REFUSE to turn over its Server to the FBI, and still hasn't? It's all a big Dem scam and excuse for losing the election!"
877889199353077760,2017-06-22 14:01:10,...Why did Democratic National Committee turn down the DHS offer to protect against hacks (long prior to election). It's all a big Dem HOAX!
877879361130688512,2017-06-22 13:22:04,"By the way, if Russia was working so hard on the 2016 Election, it all took place during the Obama Admin. Why didn't they stop them?"
877878375045447680,2017-06-22 13:18:09,Former Homeland Security Advisor Jeh Johnson is latest top intelligence official to state there was no grand scheme between Trump &amp; Russia.
877846483021602816,2017-06-22 11:11:25,Great night in Iowa - special people. Thank you!
877674738364989440,2017-06-21 23:48:58,Thank you Kirkwood Community College. Heading to the U.S. Cellular Center now for an 8pmE MAKE AMERICA GREAT AGAIN… https://t.co/n6LS32a6Zn
877663648713330688,2017-06-21 23:04:54,Just landed in Iowa. See everyone soon! #MAGA🇺🇸
877474368661618688,2017-06-21 10:32:46,"Democrats would do much better as a party if they got together with Republicans on Healthcare,Tax Cuts,Security. Obstruction doesn't work!"
877372660455546880,2017-06-21 03:48:37,"Well, the Special Elections are over and those that want to MAKE AMERICA GREAT AGAIN are 5 and O! All the Fake News, all the money spent = 0"
877363446530007040,2017-06-21 03:12:00,Ralph Norman ran a fantastic race to win in the Great State of South Carolina's 5th District. We are all honored by your success tonight!
877355739383287808,2017-06-21 02:41:23,"Congratulations to Karen Handel on her big win in Georgia 6th. Fantastic job, we are all very proud of you!"
877353797760286720,2017-06-21 02:33:40,"Thank you @FoxNews ""Huge win for President Trump and GOP in Georgia Congressional Special Election."""
877350761742688256,2017-06-21 02:21:36,Things are looking great for Karen H!
877341043171241984,2017-06-21 01:42:59,"It was a great honor to welcome President Petro Poroshenko of Ukraine to the @WhiteHouse today with @VP Pence.
➡️… https://t.co/J1ulOd6pYQ"
877234140483121152,2017-06-20 18:38:11,"While I greatly appreciate the efforts of President Xi &amp; China to help with North Korea, it has not worked out. At least I know China tried!"
877204691851108353,2017-06-20 16:41:10,The U.S. once again condemns the brutality of the North Korean regime as we mourn its latest victim. Video: https://t.co/Rvm11ZbPk7
877104262463008771,2017-06-20 10:02:06,"KAREN HANDEL FOR CONGRESS. She will fight for lower taxes, great healthcare strong security-a hard worker who will never give up! VOTE TODAY"
877101828143542272,2017-06-20 09:52:26,"RT @SheriffClarke: Happy Father's Day to all dads. My dad. Like father, like son, @realDonaldTrump supporters to the end. He an Airborne Ra…"
877101173412638720,2017-06-20 09:49:50,"Democrat Jon Ossoff, who wants to raise your taxes to the highest level and is weak on crime and security, doesn't even live in district."
876964061027684352,2017-06-20 00:45:00,"Big day tomorrow in Georgia and South Carolina. ObamaCare is dead. Dems want to raise taxes big! They can only obstruct, no ideas. Vote ""R"""
876952186143506432,2017-06-19 23:57:48,RT @joegooding: What's happening in our country isn't just an assault on our @POTUS @realDonaldTrump it's an assault on the American people…
876951845880688644,2017-06-19 23:56:27,"RT @FoxNews: New Poll Shows @POTUS Approval at 50 Percent
https://t.co/FRWlSVvxzQ"
876948721468141573,2017-06-19 23:44:02,Melania and I offer our deepest condolences to the family of Otto Warmbier. Full statement: https://t.co/8kmcA6YtFD https://t.co/EhrP4BiJeB
876921011668738050,2017-06-19 21:53:56,"It was my great honor to welcome President @JC_Varela &amp; Mrs. Varela from Panama this afternoon.🇺🇸🇵🇦
➡️… https://t.co/770OJj2uYb"
876901304207069185,2017-06-19 20:35:37,"....because he doesn't even live there! He wants to raise taxes and kill healthcare. On Tuesday, #VoteKarenHandel."
876900944444837890,2017-06-19 20:34:11,Karen Handel's opponent in #GA06 can't even vote in the district he wants to represent....
876899250071904256,2017-06-19 20:27:27,....getting great border security and healthcare. #VoteRalphNorman tomorrow!
876899176562524160,2017-06-19 20:27:10,"Ralph Norman, who is running for Congress in SC's 5th District, will be a fantastic help to me in cutting taxes, and...."
876896144944762880,2017-06-19 20:15:07,My heartfelt thoughts and prayers are with the 7 @USNavy sailors of the #USSFitzgerald and their families. ➡️… https://t.co/L3u5c8Iymh
876778344636928000,2017-06-19 12:27:01,"The Dems want to stop tax cuts, good healthcare and Border Security.Their ObamaCare is dead with 100% increases in P's. Vote now for Karen H"
876558248631042049,2017-06-18 21:52:26,RT @WhiteHouse: Happy Father's Day! https://t.co/32tFoVa4Ov
876558049565188096,2017-06-18 21:51:39,Camp David is a very special place. An honor to have spent the weekend there. Military runs it so well and are so proud of what they do!
876552203187736577,2017-06-18 21:28:25,"RT @DonaldJTrumpJr: Not surprising at all! 
Father Of Otto Warmbier: Obama Admin Told Us To Keep Quiet, Trump Admin Brought Him Home  https…"
876546864669237253,2017-06-18 21:07:12,"RT @DiamondandSilk: The Media Says:  The President Should Stop Tweeting about Russia. 
 Well, Why Don't the Media Take Their Own Advice &amp; S…"
876394578777174021,2017-06-18 11:02:04,"The new Rasmussen Poll, one of the most accurate in the 2016 Election, just out with a Trump 50% Approval Rating.That's higher than O's #'s!"
876390681056600066,2017-06-18 10:46:35,"...massive regulation cuts, 36 new legislative bills signed, great new S.C.Justice, and Infrastructure, Healthcare and Tax Cuts in works!"
876388733607694336,2017-06-18 10:38:51,"The MAKE AMERICA GREAT AGAIN agenda is doing very well despite the distraction of the Witch Hunt. Many new jobs, high business enthusiasm,.."
876079184417882116,2017-06-17 14:08:48,Thoughts and prayers with the sailors of USS Fitzgerald and their families. Thank you to our Japanese allies for th… https://t.co/BBvmTFxVkk
875888479942651909,2017-06-17 01:31:01,RT @seanhannity: #Hannity Starts in 30 minutes with @newtgingrich and my monologue on the Deep State’s allies in the media
875888258407858176,2017-06-17 01:30:08,Back from Miami where my Cuban/American friends are very happy with what I signed today. Another campaign promise that I did not forget!
875843513761583104,2017-06-16 22:32:20,"""National Security Presidential Memorandum on Strengthening the Policy of the United States Toward Cuba""
Memorandum… https://t.co/RVr9Dg2hXt"
875840132238032897,2017-06-16 22:18:54,"""Remarks by President Trump on the Policy of the U.S.A. Towards Cuba""
Video: https://t.co/jUWCjgxX5D
Transcript:… https://t.co/hILCHbPJet"
875732813278048256,2017-06-16 15:12:27,Great news! #MAGA https://t.co/pirHR7lAyT
875701471999864833,2017-06-16 13:07:55,I am being investigated for firing the FBI Director by the man who told me to fire the FBI Director! Witch Hunt
875698062030778368,2017-06-16 12:54:22,"Despite the phony Witch Hunt going on in America, the economic &amp; jobs numbers are great. Regulations way down, jobs and enthusiasm way up!"
875690204564258816,2017-06-16 12:23:08,The Fake News Media hates when I use what has turned out to be my very powerful Social Media - over 100 million people! I can go around them
875682853585129472,2017-06-16 11:53:56,"After 7 months of investigations &amp; committee hearings about my ""collusion with the Russians,""  nobody has been able to show any proof. Sad!"
875500520840060928,2017-06-15 23:49:24,#CongressionalBaseballGame⚾️ https://t.co/u8InOJTf6D
875468769212149760,2017-06-15 21:43:14,"Thank you Wisconsin! Tuesday was a great success for #WorkforceWeek at @WCTC w/ @IvankaTrump &amp; @GovWalker. 
Remarks… https://t.co/L8o396yYKX"
875441788110110727,2017-06-15 19:56:01,"Crooked H destroyed phones w/ hammer, 'bleached' emails, &amp; had husband meet w/AG days before she was cleared- &amp; they talk about obstruction?"
875438639823675392,2017-06-15 19:43:31,"Why is that Hillary Clintons family and Dems dealings with Russia are not looked at, but my non-dealings are?"
875321478849363968,2017-06-15 11:57:57,You are witnessing the single greatest WITCH HUNT in American political history - led by some very bad and conflicted people!  #MAGA
875305788708974592,2017-06-15 10:55:37,"They made up a phony collusion with the Russians story, found zero proof, so now they go for obstruction of justice on the phony story. Nice"
875166406417010688,2017-06-15 01:41:45,"Just left hospital. Rep. Steve Scalise, one of the truly great people, is in very tough shape - but he is a real fighter. Pray for Steve!"
874991696186142721,2017-06-14 14:07:31,"Happy birthday to U.S. ARMY and our soldiers. Thank you for your bravery, sacrifices, &amp; dedication. Proud to be your Commander-in-Chief!"
874971795362897921,2017-06-14 12:48:26,"Rep. Steve Scalise of Louisiana, a true friend and patriot, was badly injured but will fully recover. Our thoughts and prayers are with him."
874822136782880768,2017-06-14 02:53:45,"Just got back from Wisconsin. Great day, great people!"
874821262987730944,2017-06-14 02:50:17,RT @TuckerCarlson: .@RichardGrenell : @realDonaldTrump told Tillerson he had the full support of the U.S. Gov't to bring #OttoWarmbier home…
874767922295705600,2017-06-13 23:18:19,The passage of the @DeptVetAffairs Accountability and Whistleblower Protection Act is GREAT news for veterans! I lo… https://t.co/k45aci25BT
874728484475744257,2017-06-13 20:41:37,"Just arrived in Wisconsin to discuss JOBS, JOBS, JOBS! #MAGA🇺🇸 https://t.co/lEJ9S817yb"
874626492310978564,2017-06-13 13:56:20,"2 million more people just dropped out of ObamaCare. It is in a death spiral. Obstructionist Democrats gave up, have no answer = resist!"
874619861019840512,2017-06-13 13:29:59,"Heading to the Great State of Wisconsin to talk about JOBS, JOBS, JOBS! Big progress being made as the Real News is reporting."
874609480301936640,2017-06-13 12:48:44,Fake News is at an all time high. Where is their apology to me for all of the incorrect stories???
874608587473080320,2017-06-13 12:45:11,A.G. Lynch made law enforcement decisions for political purposes...gave Hillary Clinton a free pass and protection. Totally illegal!
874599130018054145,2017-06-13 12:07:36,RT @Corrynmb: @realDonaldTrump Liberals have an agenda and it's not in America's best interest. Keep fighting the good fight! We stand with…
874578159676665857,2017-06-13 10:44:16,"Well, as predicted, the 9th Circuit did it again - Ruled against the TRAVEL BAN at such a dangerous time in the history of our country. S.C."
874576057579565056,2017-06-13 10:35:55,The Fake News Media has never been so wrong or so dirty. Purposely incorrect stories and phony sources to meet their agenda of hate. Sad!
874418514240688129,2017-06-13 00:09:54,"Congratulations to the 2016 @ClemsonFB Tigers!
Full ceremony: https://t.co/syJUGoMhHJ
#NationalChampions🏈 https://t.co/F23NZoX2BI"
874373283919089664,2017-06-12 21:10:10,"Finally held our first full @Cabinet meeting today. With this great team, we can restore American prosperity and br… https://t.co/b0roksHTFE"
874325287143604224,2017-06-12 17:59:27,"Congratulations! 

'First New Coal Mine of Trump Era Opens in Pennsylvania' https://t.co/aIRllxNLQA"
874309930232184833,2017-06-12 16:58:25,We will NEVER FORGET the victims who lost their lives one year ago today in the horrific #PulseNightClub shooting.… https://t.co/7lZGgDJkxZ
874218586155479040,2017-06-12 10:55:27,Ivanka on @foxandfriends now!
874087477807599616,2017-06-12 02:14:29,"Great numbers on the economy. All of our work, including the passage of many bills &amp; regulation killing Executive Orders, now kicking in!"
874086142425083904,2017-06-12 02:09:10,RT @foxandfriends: .@GeraldoRivera: Chances of impeachment went from 3% to 0% with Comey's testimony https://t.co/kfeXKdpJGe
874085723762286592,2017-06-12 02:07:30,"RT @foxandfriends: ""Yesterday's hearings provided zero evidence of collusion between our campaign and the Russians because there wasn't any…"
874084433460154368,2017-06-12 02:02:23,"My daughter, Ivanka, will be on @foxandfriends tomorrow morning. Enjoy!"
873884774041079808,2017-06-11 12:49:00,"The Democrats have no message,  not on economics, not on taxes,  not on jobs, not on failing #Obamacare. They are only OBSTRUCTIONISTS!"
873879934040780801,2017-06-11 12:29:46,I believe the James Comey leaks will be far more prevalent than anyone ever thought possible. Totally illegal? Very 'cowardly!'
873878232264822784,2017-06-11 12:23:01,"...way up. Regulations way down. 600,000+ new jobs added. Unemployment down to 4.3%. Business and economic enthusiasm way up- record levels!"
873878061778907137,2017-06-11 12:22:20,The #FakeNews MSM doesn't report the great economic news since Election Day. #DOW up 16%. #NASDAQ up 19.5%. Drilling &amp; energy sector...
873643935993708544,2017-06-10 20:52:00,America is going to build again. Under budget and ahead of schedule. Time to put #AmericaFirst! #InfrastructureWeek… https://t.co/D5TbbjXcN3
873353586025132038,2017-06-10 01:38:15,"Time to start building in our country, with American workers &amp; with American iron, aluminum &amp; steel. It is time to… https://t.co/rGZCRyeCMZ"
873311842956914688,2017-06-09 22:52:23,"It is time to rebuild OUR country, to bring back OUR jobs, to restore OUR dreams, &amp; yes, to put #AmericaFirst! TY O… https://t.co/2b2bXwxGkA"
873250570508922880,2017-06-09 18:48:54,A great honor to host and welcome leaders from around America to the @WhiteHouse Infrastructure Summit.… https://t.co/5f6cN3HboQ
873245481488535554,2017-06-09 18:28:41,"An honor to join the @FaithandFreedom Coalition yesterday. In America, we don't worship government. We worship God.… https://t.co/1ds8BrzUQe"
873183401620230144,2017-06-09 14:22:00,Congratulations to Jeb Hensarling &amp; Republicans on successful House vote to repeal major parts of the 2010 Dodd-Frank financial law. GROWTH!
873180518493429765,2017-06-09 14:10:33,RT @AlanDersh: We should stop talking about obstruction of justice. No plausible case. We must distinguish crimes from pol sins https://t.c…
873131235614347264,2017-06-09 10:54:43,Great reporting by @foxandfriends and so many others. Thank you!
873120139222306817,2017-06-09 10:10:37,"Despite so many false statements and lies, total and complete vindication...and WOW, Comey is a leaker!"
872427222392504320,2017-06-07 12:17:13,"Getting ready to leave for Cincinnati, in the GREAT STATE of OHIO, to meet with ObamaCare victims and talk Healthcare &amp; also Infrastructure!"
872419018799550464,2017-06-07 11:44:37,"I will be nominating Christopher A. Wray, a man of impeccable credentials, to be the new Director of the FBI. Details to follow."
872258719404482561,2017-06-07 01:07:39,Senate passed the VA Accountability Act. The House should get this bill to my desk ASAP! We can’t tolerate substandard care for our vets.
872253002266161153,2017-06-07 00:44:56,"#ICYMI: Announcement of Air Traffic Control Initiative 

Watch➡️https://t.co/IMiZr22gAw"
872243414930264065,2017-06-07 00:06:50,"Great meeting with @HouseGOP and @SenateGOP leaders, including @SpeakerRyan, @SenateMajLdr, @GOPLeader, @JohnCornyn… https://t.co/G03W8CEtCS"
